[
  {
    "catch_methods": [
      "fishing"
    ],
    "is_legendary": false,
    "item_id": "alligator_gar",
    "rarity": "rare",
    "school_size": null,
    "shadow_size": "giant"
  },
  {
    "catch_methods": [],
    "is_legendary": false,
    "item_id": "amberjack",
    "rarity": "rare",
    "school_size": null,
    "shadow_size": "large"
  },
  {
    "catch_methods": [
      "fishing",
      "diving"
    ],
    "is_legendary": false,
    "item_id": "anchovy",
    "rarity": "common",
    "school_size": null,
    "shadow_size": "small"
  },
  {
    "catch_methods": [
      "fishing"
    ],
    "is_legendary": false,
    "item_id": "angel_fish",
    "rarity": "common",
    "school_size": null,
    "shadow_size": "small"
  },
  {
    "catch_methods": [
      "fishing"
    ],
    "is_legendary": false,
    "item_id": "archerfish",
    "rarity": "uncommon",
    "school_size": null,
    "shadow_size": "small"
  },
  {
    "catch_methods": [
      "fishing"
    ],
    "is_legendary": false,
    "item_id": "armored_bass",
    "rarity": "common",
    "school_size": null,
    "shadow_size": "medium"
  },
  {
    "catch_methods": [],
    "is_legendary": false,
    "item_id": "bait_thief",
    "rarity": "common",
    "school_size": null,
    "shadow_size": "medium"
  },
  {
    "catch_methods": [
      "fishing"
    ],
    "is_legendary": false,
    "item_id": "barb",
    "rarity": "common",
    "school_size": null,
    "shadow_size": "small"
  },
  {
    "catch_methods": [],
    "is_legendary": false,
    "item_id": "blue_crab",
    "rarity": "common",
    "school_size": null,
    "shadow_size": "small"
  },
  {
    "catch_methods": [
      "fishing"
    ],
    "is_legendary": false,
    "item_id": "bluefish",
    "rarity": "common",
    "school_size": null,
    "shadow_size": "large"
  },
  {
    "catch_methods": [
      "fishing"
    ],
    "is_legendary": false,
    "item_id": "bluegill",
    "rarity": "common",
    "school_size": null,
    "shadow_size": "small"
  },
  {
    "catch_methods": [
      "fishing"
    ],
    "is_legendary": false,
    "item_id": "bonito",
    "rarity": "common",
    "school_size": null,
    "shadow_size": "medium"
  },
  {
    "catch_methods": [
      "fishing"
    ],
    "is_legendary": false,
    "item_id": "bowfish",
    "rarity": "common",
    "school_size": null,
    "shadow_size": "large"
  },
  {
    "catch_methods": [
      "fishing"
    ],
    "is_legendary": false,
    "item_id": "bream",
    "rarity": "common",
    "school_size": null,
    "shadow_size": "large"
  },
  {
    "catch_methods": [
      "fishing"
    ],
    "is_legendary": false,
    "item_id": "brown_bullhead",
    "rarity": "common",
    "school_size": null,
    "shadow_size": "medium"
  },
  {
    "catch_methods": [
      "fishing"
    ],
    "is_legendary": false,
    "item_id": "brown_trout",
    "rarity": "common",
    "school_size": null,
    "shadow_size": "large"
  },
  {
    "catch_methods": [
      "fishing",
      "diving"
    ],
    "is_legendary": false,
    "item_id": "bullfrog",
    "rarity": "common",
    "school_size": null,
    "shadow_size": "small"
  },
  {
    "catch_methods": [
      "fishing"
    ],
    "is_legendary": false,
    "item_id": "burbot",
    "rarity": "common",
    "school_size": null,
    "shadow_size": "large"
  },
  {
    "catch_methods": [
      "fishing"
    ],
    "is_legendary": false,
    "item_id": "butterfish",
    "rarity": "common",
    "school_size": null,
    "shadow_size": "small"
  },
  {
    "catch_methods": [
      "fishing"
    ],
    "is_legendary": false,
    "item_id": "candelabra_seadragon",
    "rarity": "uncommon",
    "school_size": null,
    "shadow_size": "small"
  },
  {
    "catch_methods": [
      "fishing"
    ],
    "is_legendary": false,
    "item_id": "carp",
    "rarity": "common",
    "school_size": null,
    "shadow_size": "medium"
  },
  {
    "catch_methods": [
      "fishing"
    ],
    "is_legendary": false,
    "item_id": "catfish",
    "rarity": "uncommon",
    "school_size": null,
    "shadow_size": "medium"
  },
  {
    "catch_methods": [
      "fishing"
    ],
    "is_legendary": false,
    "item_id": "cave_eel",
    "rarity": "uncommon",
    "school_size": null,
    "shadow_size": "medium"
  },
  {
    "catch_methods": [
      "fishing"
    ],
    "is_legendary": false,
    "item_id": "cave_shark",
    "rarity": "rare",
    "school_size": null,
    "shadow_size": "large"
  },
  {
    "catch_methods": [
      "fishing"
    ],
    "is_legendary": false,
    "item_id": "cave_shrimp",
    "rarity": "common",
    "school_size": null,
    "shadow_size": "small"
  },
  {
    "catch_methods": [
      "fishing"
    ],
    "is_legendary": false,
    "item_id": "char",
    "rarity": "common",
    "school_size": null,
    "shadow_size": "large"
  },
  {
    "catch_methods": [
      "fishing"
    ],
    "is_legendary": true,
    "item_id": "cherry_fish",
    "rarity": "legendary",
    "school_size": null,
    "shadow_size": "small"
  },
  {
    "catch_methods": [
      "fishing"
    ],
    "is_legendary": false,
    "item_id": "chub",
    "rarity": "common",
    "school_size": null,
    "shadow_size": "small"
  },
  {
    "catch_methods": [
      "fishing"
    ],
    "is_legendary": false,
    "item_id": "chum",
    "rarity": "uncommon",
    "school_size": null,
    "shadow_size": "large"
  },
  {
    "catch_methods": [
      "diving"
    ],
    "is_legendary": false,
    "item_id": "clam",
    "rarity": "common",
    "school_size": null,
    "shadow_size": null
  },
  {
    "catch_methods": [
      "fishing",
      "diving"
    ],
    "is_legendary": false,
    "item_id": "cod",
    "rarity": "common",
    "school_size": null,
    "shadow_size": "large"
  },
  {
    "catch_methods": [
      "fishing"
    ],
    "is_legendary": false,
    "item_id": "coelacanth",
    "rarity": "rare",
    "school_size": null,
    "shadow_size": "large"
  },
  {
    "catch_methods": [],
    "is_legendary": false,
    "item_id": "copper_rockfish",
    "rarity": "common",
    "school_size": null,
    "shadow_size": "medium"
  },
  {
    "catch_methods": [
      "fishing"
    ],
    "is_legendary": false,
    "item_id": "crab",
    "rarity": "common",
    "school_size": null,
    "shadow_size": "small"
  },
  {
    "catch_methods": [
      "diving"
    ],
    "is_legendary": false,
    "item_id": "crayfish",
    "rarity": "common",
    "school_size": null,
    "shadow_size": null
  },
  {
    "catch_methods": [
      "fishing"
    ],
    "is_legendary": false,
    "item_id": "crucian_carp",
    "rarity": "common",
    "school_size": null,
    "shadow_size": "medium"
  },
  {
    "catch_methods": [
      "fishing"
    ],
    "is_legendary": false,
    "item_id": "dace",
    "rarity": "common",
    "school_size": null,
    "shadow_size": "small"
  },
  {
    "catch_methods": [
      "fishing"
    ],
    "is_legendary": false,
    "item_id": "dart",
    "rarity": "common",
    "school_size": null,
    "shadow_size": "small"
  },
  {
    "catch_methods": [
      "fishing"
    ],
    "is_legendary": false,
    "item_id": "earth_eel",
    "rarity": "common",
    "school_size": null,
    "shadow_size": "medium"
  },
  {
    "catch_methods": [
      "fishing"
    ],
    "is_legendary": false,
    "item_id": "emerald_horned_charger",
    "rarity": "rare",
    "school_size": null,
    "shadow_size": "large"
  },
  {
    "catch_methods": [
      "fishing"
    ],
    "is_legendary": false,
    "item_id": "firesail_fish",
    "rarity": "rare",
    "school_size": null,
    "shadow_size": "large"
  },
  {
    "catch_methods": [
      "fishing"
    ],
    "is_legendary": false,
    "item_id": "flathead_catfish",
    "rarity": "common",
    "school_size": null,
    "shadow_size": "medium"
  },
  {
    "catch_methods": [
      "fishing"
    ],
    "is_legendary": false,
    "item_id": "forest_perch",
    "rarity": "common",
    "school_size": null,
    "shadow_size": "medium"
  },
  {
    "catch_methods": [
      "fishing"
    ],
    "is_legendary": false,
    "item_id": "freshwater_eel",
    "rarity": "common",
    "school_size": null,
    "shadow_size": "medium"
  },
  {
    "catch_methods": [
      "diving"
    ],
    "is_legendary": false,
    "item_id": "freshwater_oyster",
    "rarity": "common",
    "school_size": null,
    "shadow_size": null
  },
  {
    "catch_methods": [
      "fishing",
      "diving"
    ],
    "is_legendary": false,
    "item_id": "frog",
    "rarity": "common",
    "school_size": null,
    "shadow_size": "small"
  },
  {
    "catch_methods": [
      "fishing"
    ],
    "is_legendary": false,
    "item_id": "gar",
    "rarity": "common",
    "school_size": null,
    "shadow_size": "large"
  },
  {
    "catch_methods": [
      "fishing"
    ],
    "is_legendary": false,
    "item_id": "gazer",
    "rarity": "uncommon",
    "school_size": null,
    "shadow_size": "medium"
  },
  {
    "catch_methods": [
      "fishing"
    ],
    "is_legendary": false,
    "item_id": "giant_jellyfish",
    "rarity": "common",
    "school_size": null,
    "shadow_size": "large"
  },
  {
    "catch_methods": [
      "fishing"
    ],
    "is_legendary": false,
    "item_id": "giant_koi",
    "rarity": "rare",
    "school_size": null,
    "shadow_size": "giant"
  },
  {
    "catch_methods": [
      "fishing"
    ],
    "is_legendary": false,
    "item_id": "giant_tilapia",
    "rarity": "uncommon",
    "school_size": null,
    "shadow_size": "giant"
  },
  {
    "catch_methods": [
      "fishing"
    ],
    "is_legendary": false,
    "item_id": "goby",
    "rarity": "uncommon",
    "school_size": null,
    "shadow_size": "medium"
  },
  {
    "catch_methods": [],
    "is_legendary": false,
    "item_id": "golden_eel",
    "rarity": "rare",
    "school_size": null,
    "shadow_size": "giant"
  },
  {
    "catch_methods": [
      "fishing"
    ],
    "is_legendary": false,
    "item_id": "golden_shiner",
    "rarity": "common",
    "school_size": null,